{
  "contract": "arbiter_exchange",
  "version": "v1",
  "exchange_id": "ax:real-case-remote-workflow:case:hyp:gc:45",
  "case_id": "case:hyp:gc:45",
  "sent_packet": {
    "candidate_id": "gc_case:remote_workflow_v1b:45",
    "domain": "jigsaw_kernel_bundle",
    "candidate_type": "opportunity_case",
    "summary": "The case is clear enough and aligns with the expected state.",
    "evidence": {
      "source_count": 4,
      "freshness_days": 2,
      "fit_score": 0.8,
      "estimated_value_band": "aligned"
    },
    "context": {
      "buyer_profile": "remote_workflow_v1b",
      "current_queue_pressure": "medium",
      "action_cost": "medium",
      "jigsaw_bundle_id": "kernel_bundle:kin_gc_45_remote_workflow_v1b",
      "jigsaw_bundle_judgment": "aligned",
      "kernel_sequence": [
        "observed_state",
        "expected_state",
        "contradiction"
      ]
    }
  },
  "received_packet": {
    "candidate_id": "gc_case:remote_workflow_v1b:45",
    "judgement": "promoted",
    "confidence": 0.81,
    "reason_summary": "Strong fit, recent supporting evidence, and acceptable evidence depth justify immediate review.",
    "key_factors": [
      "High relevance to target profile",
      "Evidence is recent",
      "Multiple sources support the candidate"
    ],
    "recommended_action": "prioritise_for_review"
  },
  "validation_passed": true,
  "arbiter_metadata": {
    "profile_name": "remote_workflow_v1b"
  },
  "timestamp": "2026-03-15T11:45:00Z"
}